{
  "$schema": "../../schema/suite.schema.json",
  "id": "web.fileapi",
  "domain": "web",
  "suite": "fileapi",
  "title": "FileAPI",
  "origin": {
    "repo": "https://github.com/web-platform-tests/wpt",
    "ref": "55d076dca564300616a75eec5ec696e805c7bc3b",
    "kind": "git"
  },
  "fetch": {
    "entries": [
      {
        "kind": "source",
        "label": "wpt fileapi blob array buffer",
        "root": "../checkouts/wpt",
        "files": [
          {
            "source": "FileAPI/blob/Blob-array-buffer.any.js",
            "target": "blob/Blob-array-buffer.any.js"
          }
        ]
      },
      {
        "kind": "translated",
        "label": "translated tests",
        "files": [
          {
            "path": "blob/Blob-array-buffer.any.ts",
            "source": "blob/Blob-array-buffer.any.js"
          }
        ]
      }
    ]
  }
}
