{
  "$schema": "../../schema/suite.schema.json",
  "id": "web.filesystem-access",
  "domain": "web",
  "suite": "filesystem-access",
  "title": "File System Access",
  "origin": {
    "repo": "https://github.com/web-platform-tests/wpt",
    "ref": "55d076dca564300616a75eec5ec696e805c7bc3b",
    "kind": "git"
  }
}
