{
  "$schema": "../../schema/suite.schema.json",
  "id": "ecma.math",
  "domain": "ecma",
  "suite": "math",
  "title": "Math",
  "origin": {
    "repo": "https://github.com/tc39/test262",
    "ref": "5c8206929d81b2d3d727ca6aac56c18358c8d790",
    "kind": "git"
  },
  "fetch": {
    "entries": [
      {
        "kind": "source",
        "label": "test262 math",
        "version": "2026-03-21",
        "layout": "strip",
        "paths": [
          "test/built-ins/Math"
        ]
      }
    ]
  }
}
